<?xml version="1.0" encoding="UTF-8"?>
<!--
To change this license header, choose License Headers in Project Properties.
To change this template file, choose Tools | Templates
and open the template in the editor.
-->
<?xml-stylesheet  href="contacto.xsl" type="text/xsl"?>

<paginaContactos xmlns:xsi="http://www.w3.org/2001/XMLSchema-instance"
                 xsi:noNamespaceSchemaLocation="contacto.xsd"> 
    <imagenes>
        <imagenCabecera imagenUri="../imagenes/Cabecera.jpg"/> 
        <imagenCarruse imagenUri="../imagenes/Carrusel4.jpg"/>       
    </imagenes> 
    <dirección>
      <nombreLugar>
        Centro de jardinería y exposición
      </nombreLugar>
      <calle>
          <nombre>Carretera de Barcelona</nombre>
          <número>Km. 16,500</número>
          <referencia>Autovía A2 Km.16 sentido Madrid</referencia>
          <referencia2>Autovía A2 Km. 16,500 sentido Madrid</referencia2>
      </calle>
      <sector>
          San Fernando de Henares
      </sector>
      <localidad>
          Madrid
      </localidad>      
      <códigoPostal>
          28830
      </códigoPostal>
      <país>
          España
      </país>
    </dirección>  
    <teléfono>
        +34 91 555 55 55
    </teléfono>
    <fax>
     +34 91 555 55 55 
    </fax> 
    <correosElectrónicos>
        <correoElectronicoCentroPagina>
            info@viverospena.com
        </correoElectronicoCentroPagina>
         <correoElectronicoPiePagina>
            info@viveroUAH.com
        </correoElectronicoPiePagina>     
    </correosElectrónicos>   
    <formulariosContactos>
        <contacto>
            <nombre> 
               Salvador
           </nombre> 
           <correoElectrónico> 
               scuevas@outlook.com
           </correoElectrónico> 
           <asunto> 
               Mensaje de prueba
           </asunto> 
            <mensaje> 
               cuerpo del mensaje de prueba
           </mensaje> 
           <condicionesGenerales> 
               true
           </condicionesGenerales>
        </contacto>              
     </formulariosContactos> 
  
     <iframeUrl url="https://www.google.com/maps/embed?pb=!1m18!1m12!1m3!1d3033.476855108628!2d-3.3451889999999795!3d40.50895!2m3!1f0!2f0!3f0!3m2!1i1024!2i768!4f13.1!3m3!1m2!1s0xd424bfc76f087f1%3A0xced3a1e98249a30f!2sUAH+Campus+Cient%C3%ADfico-Tecnol%C3%B3gico+(Externo)!5e0!3m2!1ses!2ses!4v1428406958641"/>
    
</paginaContactos>
